{
  "id": "task-20260319T192529Z-ab306114",
  "title": "Verify delivery partial accepted",
  "objective": "Verify delivery partial accepted",
  "status": "done",
  "owner": "unassigned",
  "source_channel": "operator",
  "created_at": "2026-03-19T19:25:29+00:00",
  "updated_at": "2026-03-23T04:10:24Z",
  "acceptance_criteria": [],
  "evidence": [
    {
      "type": "migration",
      "path": "tasks/legacy_backup/task-20260319T192529Z-ab306114.json.bak.20260323T041024Z.json",
      "note": "Migrated from legacy representation. legacy_ref=task-20260319T192529Z-ab306114"
    }
  ],
  "artifacts": [],
  "closure_note": "",
  "history": [
    {
      "at": "2026-03-19T19:25:29+00:00",
      "actor": "legacy",
      "action": "legacy_note",
      "note": "technical acceptance closed before user visibility"
    },
    {
      "at": "2026-03-23T04:10:24Z",
      "actor": "system",
      "action": "migrated_from_legacy",
      "note": "Migrated legacy task. legacy_ref=task-20260319T192529Z-ab306114; backup=tasks/legacy_backup/task-20260319T192529Z-ab306114.json.bak.20260323T041024Z.json"
    }
  ]
}
