{
  "id": "task-20260315T054717Z-014330a8",
  "title": "Readiness integration / artifacts",
  "objective": "Readiness integration / artifacts",
  "status": "failed",
  "owner": "unassigned",
  "source_channel": "operator",
  "created_at": "2026-03-15T05:47:17+00:00",
  "updated_at": "2026-03-20T20:37:06Z",
  "acceptance_criteria": [],
  "evidence": [
    {
      "type": "migration",
      "path": "tasks/legacy_backup/task-20260315T054717Z-014330a8.json.bak.20260320T203706Z.json",
      "note": "Migrated from legacy representation. legacy_ref=task-20260315T054717Z-014330a8"
    }
  ],
  "artifacts": [],
  "closure_note": "",
  "history": [
    {
      "at": "2026-03-15T05:47:17+00:00",
      "actor": "legacy",
      "action": "legacy_note",
      "note": "browser blocked before artifact execution"
    },
    {
      "at": "2026-03-20T20:37:06Z",
      "actor": "system",
      "action": "migrated_from_legacy",
      "note": "Migrated legacy task. legacy_ref=task-20260315T054717Z-014330a8; backup=tasks/legacy_backup/task-20260315T054717Z-014330a8.json.bak.20260320T203706Z.json"
    }
  ]
}
