{
  "id": "task-20260317T023859Z-f97df71c",
  "title": "Verify WhatsApp verified-by-user path",
  "objective": "Verify WhatsApp verified-by-user path",
  "status": "todo",
  "owner": "unassigned",
  "source_channel": "operator",
  "created_at": "2026-03-17T02:38:59+00:00",
  "updated_at": "2026-03-20T23:41:07Z",
  "acceptance_criteria": [],
  "evidence": [
    {
      "type": "migration",
      "path": "tasks/legacy_backup/task-20260317T023859Z-f97df71c.json.bak.20260320T234107Z.json",
      "note": "Migrated from legacy representation. legacy_ref=task-20260317T023859Z-f97df71c"
    }
  ],
  "artifacts": [],
  "closure_note": "",
  "history": [
    {
      "at": "2026-03-17T02:38:59+00:00",
      "actor": "legacy",
      "action": "legacy_note",
      "note": "whatsapp delivery requested recorded for +5491100000003 with allowed claim 'solicitado'"
    },
    {
      "at": "2026-03-17T02:38:59+00:00",
      "actor": "legacy",
      "action": "legacy_note",
      "note": "whatsapp delivery accepted_by_gateway recorded for +5491100000003 with allowed claim 'aceptado por gateway'"
    },
    {
      "at": "2026-03-17T02:38:59+00:00",
      "actor": "legacy",
      "action": "legacy_note",
      "note": "whatsapp delivery delivered recorded for +5491100000003 with allowed claim 'entregado'"
    },
    {
      "at": "2026-03-17T02:38:59+00:00",
      "actor": "legacy",
      "action": "legacy_note",
      "note": "whatsapp delivery verified_by_user recorded for +5491100000003 with allowed claim 'confirmado por usuario'"
    },
    {
      "at": "2026-03-20T23:41:07Z",
      "actor": "system",
      "action": "migrated_from_legacy",
      "note": "Migrated legacy task. legacy_ref=task-20260317T023859Z-f97df71c; backup=tasks/legacy_backup/task-20260317T023859Z-f97df71c.json.bak.20260320T234107Z.json"
    }
  ]
}
