{
  "id": "task-20260317T014812Z-b32c27f0",
  "title": "Verify missing media path",
  "objective": "Verify missing media path",
  "status": "todo",
  "owner": "unassigned",
  "source_channel": "operator",
  "created_at": "2026-03-17T01:48:12+00:00",
  "updated_at": "2026-03-20T23:12:21Z",
  "acceptance_criteria": [],
  "evidence": [
    {
      "type": "migration",
      "path": "tasks/legacy_backup/task-20260317T014812Z-b32c27f0.json.bak.20260320T231221Z.json",
      "note": "Migrated from legacy representation. legacy_ref=task-20260317T014812Z-b32c27f0"
    }
  ],
  "artifacts": [],
  "closure_note": "",
  "history": [
    {
      "at": "2026-03-17T01:48:12+00:00",
      "actor": "legacy",
      "action": "legacy_note",
      "note": "media ingestion blocked recorded for 20260317T014810482855Z-missing-media.md"
    },
    {
      "at": "2026-03-20T23:12:21Z",
      "actor": "system",
      "action": "migrated_from_legacy",
      "note": "Migrated legacy task. legacy_ref=task-20260317T014812Z-b32c27f0; backup=tasks/legacy_backup/task-20260317T014812Z-b32c27f0.json.bak.20260320T231221Z.json"
    }
  ]
}
