{
  "id": "task-20260317T023902Z-d40e908a",
  "title": "Verify directory media rejection",
  "objective": "Verify directory media rejection",
  "status": "todo",
  "owner": "unassigned",
  "source_channel": "operator",
  "created_at": "2026-03-17T02:39:02+00:00",
  "updated_at": "2026-03-20T23:41:08Z",
  "acceptance_criteria": [],
  "evidence": [
    {
      "type": "migration",
      "path": "tasks/legacy_backup/task-20260317T023902Z-d40e908a.json.bak.20260320T234108Z.json",
      "note": "Migrated from legacy representation. legacy_ref=task-20260317T023902Z-d40e908a"
    }
  ],
  "artifacts": [],
  "closure_note": "",
  "history": [
    {
      "at": "2026-03-17T02:39:02+00:00",
      "actor": "legacy",
      "action": "legacy_note",
      "note": "media ingestion failed recorded for manual"
    },
    {
      "at": "2026-03-20T23:41:08Z",
      "actor": "system",
      "action": "migrated_from_legacy",
      "note": "Migrated legacy task. legacy_ref=task-20260317T023902Z-d40e908a; backup=tasks/legacy_backup/task-20260317T023902Z-d40e908a.json.bak.20260320T234108Z.json"
    }
  ]
}
