{
  "id": "task-20260319T183956Z-795e4de4",
  "title": "Verify WhatsApp provider ambiguous truth",
  "objective": "Verify WhatsApp provider ambiguous truth",
  "status": "todo",
  "owner": "unassigned",
  "source_channel": "operator",
  "created_at": "2026-03-19T18:39:56+00:00",
  "updated_at": "2026-03-20T23:54:04Z",
  "acceptance_criteria": [],
  "evidence": [
    {
      "type": "migration",
      "path": "tasks/legacy_backup/task-20260319T183956Z-795e4de4.json.bak.20260320T235404Z.json",
      "note": "Migrated from legacy representation. legacy_ref=task-20260319T183956Z-795e4de4"
    }
  ],
  "artifacts": [],
  "closure_note": "",
  "history": [
    {
      "at": "2026-03-19T18:39:56+00:00",
      "actor": "legacy",
      "action": "legacy_note",
      "note": "whatsapp delivery requested recorded for +5491100000012 with allowed claim 'solicitado'"
    },
    {
      "at": "2026-03-19T18:39:56+00:00",
      "actor": "legacy",
      "action": "legacy_note",
      "note": "whatsapp delivery accepted_by_gateway recorded for +5491100000012 with allowed claim 'aceptado por gateway'"
    },
    {
      "at": "2026-03-19T18:39:56+00:00",
      "actor": "legacy",
      "action": "legacy_note",
      "note": "whatsapp delivery provider_delivery_unproved recorded for +5491100000012 with allowed claim 'sin prueba concluyente del proveedor'"
    },
    {
      "at": "2026-03-20T23:54:04Z",
      "actor": "system",
      "action": "migrated_from_legacy",
      "note": "Migrated legacy task. legacy_ref=task-20260319T183956Z-795e4de4; backup=tasks/legacy_backup/task-20260319T183956Z-795e4de4.json.bak.20260320T235404Z.json"
    }
  ]
}
