{
  "id": "task-20260319T183959Z-0dc272e7",
  "title": "Verify missing media path",
  "objective": "Verify missing media path",
  "status": "todo",
  "owner": "unassigned",
  "source_channel": "operator",
  "created_at": "2026-03-19T18:39:59+00:00",
  "updated_at": "2026-03-20T23:54:04Z",
  "acceptance_criteria": [],
  "evidence": [
    {
      "type": "migration",
      "path": "tasks/legacy_backup/task-20260319T183959Z-0dc272e7.json.bak.20260320T235404Z.json",
      "note": "Migrated from legacy representation. legacy_ref=task-20260319T183959Z-0dc272e7"
    }
  ],
  "artifacts": [],
  "closure_note": "",
  "history": [
    {
      "at": "2026-03-19T18:39:59+00:00",
      "actor": "legacy",
      "action": "legacy_note",
      "note": "media ingestion blocked recorded for 20260319T183958294198Z-missing-media.md"
    },
    {
      "at": "2026-03-20T23:54:04Z",
      "actor": "system",
      "action": "migrated_from_legacy",
      "note": "Migrated legacy task. legacy_ref=task-20260319T183959Z-0dc272e7; backup=tasks/legacy_backup/task-20260319T183959Z-0dc272e7.json.bak.20260320T235404Z.json"
    }
  ]
}
