{
  "id": "task-20260317T014805Z-f69eec4a",
  "title": "Live user journey smoke / WhatsApp delivery",
  "objective": "Live user journey smoke / WhatsApp delivery",
  "status": "blocked",
  "owner": "unassigned",
  "source_channel": "operator",
  "created_at": "2026-03-17T01:48:05+00:00",
  "updated_at": "2026-03-20T23:12:21Z",
  "acceptance_criteria": [],
  "evidence": [
    {
      "type": "migration",
      "path": "tasks/legacy_backup/task-20260317T014805Z-f69eec4a.json.bak.20260320T231221Z.json",
      "note": "Migrated from legacy representation. legacy_ref=task-20260317T014805Z-f69eec4a"
    }
  ],
  "artifacts": [],
  "closure_note": "",
  "history": [
    {
      "at": "2026-03-17T01:48:05+00:00",
      "actor": "legacy",
      "action": "legacy_note",
      "note": "media ingestion registered recorded for 20260317T014805169669Z-journey-a-visible-artifact.md"
    },
    {
      "at": "2026-03-17T01:48:05+00:00",
      "actor": "legacy",
      "action": "legacy_note",
      "note": "media readiness verified recorded for 20260317T014805169669Z-journey-a-visible-artifact.md"
    },
    {
      "at": "2026-03-17T01:48:05+00:00",
      "actor": "legacy",
      "action": "legacy_note",
      "note": "whatsapp delivery requested recorded for +5491100000007 with allowed claim 'solicitado'"
    },
    {
      "at": "2026-03-17T01:48:05+00:00",
      "actor": "legacy",
      "action": "legacy_note",
      "note": "live user journey WhatsApp path blocked before any live gateway/provider delivery proof"
    },
    {
      "at": "2026-03-20T23:12:21Z",
      "actor": "system",
      "action": "migrated_from_legacy",
      "note": "Migrated legacy task. legacy_ref=task-20260317T014805Z-f69eec4a; backup=tasks/legacy_backup/task-20260317T014805Z-f69eec4a.json.bak.20260320T231221Z.json"
    }
  ]
}
