{
  "id": "task-20260316T003611Z-f60b751c",
  "title": "Verify chain execution audit / local self-check",
  "objective": "Validate the local Golem environment before a delegated worker run.",
  "status": "done",
  "owner": "unassigned",
  "source_channel": "operator",
  "created_at": "2026-03-16T00:36:11+00:00",
  "updated_at": "2026-03-20T21:10:40Z",
  "acceptance_criteria": [],
  "evidence": [
    {
      "type": "migration",
      "path": "tasks/legacy_backup/task-20260316T003611Z-f60b751c.json.bak.20260320T211040Z.json",
      "note": "Migrated from legacy representation. legacy_ref=task-20260316T003611Z-f60b751c"
    }
  ],
  "artifacts": [],
  "closure_note": "",
  "history": [
    {
      "at": "2026-03-16T00:36:11+00:00",
      "actor": "legacy",
      "action": "legacy_note",
      "note": "self-check completed and task closed"
    },
    {
      "at": "2026-03-20T21:10:40Z",
      "actor": "system",
      "action": "migrated_from_legacy",
      "note": "Migrated legacy task. legacy_ref=task-20260316T003611Z-f60b751c; backup=tasks/legacy_backup/task-20260316T003611Z-f60b751c.json.bak.20260320T211040Z.json"
    }
  ]
}
