{
  "id": "task-20260317T011025Z-43e9bf89",
  "title": "Verify directory media rejection",
  "objective": "Verify directory media rejection",
  "status": "todo",
  "owner": "unassigned",
  "source_channel": "operator",
  "created_at": "2026-03-17T01:10:25+00:00",
  "updated_at": "2026-03-20T22:57:06Z",
  "acceptance_criteria": [],
  "evidence": [
    {
      "type": "migration",
      "path": "tasks/legacy_backup/task-20260317T011025Z-43e9bf89.json.bak.20260320T225706Z.json",
      "note": "Migrated from legacy representation. legacy_ref=task-20260317T011025Z-43e9bf89"
    }
  ],
  "artifacts": [],
  "closure_note": "",
  "history": [
    {
      "at": "2026-03-17T01:10:25+00:00",
      "actor": "legacy",
      "action": "legacy_note",
      "note": "media ingestion failed recorded for manual"
    },
    {
      "at": "2026-03-20T22:57:06Z",
      "actor": "system",
      "action": "migrated_from_legacy",
      "note": "Migrated legacy task. legacy_ref=task-20260317T011025Z-43e9bf89; backup=tasks/legacy_backup/task-20260317T011025Z-43e9bf89.json.bak.20260320T225706Z.json"
    }
  ]
}
