{
  "id": "task-20260316T003522Z-e0899666",
  "title": "Worker packet roundtrip success path / local self-check",
  "objective": "Validate the local Golem environment before a delegated worker run.",
  "status": "done",
  "owner": "unassigned",
  "source_channel": "operator",
  "created_at": "2026-03-16T00:35:22+00:00",
  "updated_at": "2026-03-20T21:10:39Z",
  "acceptance_criteria": [],
  "evidence": [
    {
      "type": "migration",
      "path": "tasks/legacy_backup/task-20260316T003522Z-e0899666.json.bak.20260320T211039Z.json",
      "note": "Migrated from legacy representation. legacy_ref=task-20260316T003522Z-e0899666"
    }
  ],
  "artifacts": [],
  "closure_note": "",
  "history": [
    {
      "at": "2026-03-16T00:35:22+00:00",
      "actor": "legacy",
      "action": "legacy_note",
      "note": "self-check completed and task closed"
    },
    {
      "at": "2026-03-20T21:10:39Z",
      "actor": "system",
      "action": "migrated_from_legacy",
      "note": "Migrated legacy task. legacy_ref=task-20260316T003522Z-e0899666; backup=tasks/legacy_backup/task-20260316T003522Z-e0899666.json.bak.20260320T211039Z.json"
    }
  ]
}
