{
  "id": "task-20260317T020853Z-1119951d",
  "title": "Verify delivery drift path",
  "objective": "Verify delivery drift path",
  "status": "todo",
  "owner": "unassigned",
  "source_channel": "operator",
  "created_at": "2026-03-17T02:08:53+00:00",
  "updated_at": "2026-03-20T23:12:22Z",
  "acceptance_criteria": [],
  "evidence": [
    {
      "type": "migration",
      "path": "tasks/legacy_backup/task-20260317T020853Z-1119951d.json.bak.20260320T231222Z.json",
      "note": "Migrated from legacy representation. legacy_ref=task-20260317T020853Z-1119951d"
    }
  ],
  "artifacts": [],
  "closure_note": "",
  "history": [
    {
      "at": "2026-03-17T02:08:53+00:00",
      "actor": "legacy",
      "action": "legacy_imported",
      "note": "Legacy task imported from raw representation. legacy_ref=task-20260317T020853Z-1119951d"
    },
    {
      "at": "2026-03-20T23:12:22Z",
      "actor": "system",
      "action": "migrated_from_legacy",
      "note": "Migrated legacy task. legacy_ref=task-20260317T020853Z-1119951d; backup=tasks/legacy_backup/task-20260317T020853Z-1119951d.json.bak.20260320T231222Z.json"
    }
  ]
}
