{
  "id": "task-20260319T190843Z-77fc20ae",
  "title": "Verify WhatsApp provider drift detection",
  "objective": "Verify WhatsApp provider drift detection",
  "status": "todo",
  "owner": "unassigned",
  "source_channel": "operator",
  "created_at": "2026-03-19T19:08:44+00:00",
  "updated_at": "2026-03-20T23:54:07Z",
  "acceptance_criteria": [],
  "evidence": [
    {
      "type": "migration",
      "path": "tasks/legacy_backup/task-20260319T190843Z-77fc20ae.json.bak.20260320T235407Z.json",
      "note": "Migrated from legacy representation. legacy_ref=task-20260319T190843Z-77fc20ae"
    }
  ],
  "artifacts": [],
  "closure_note": "",
  "history": [
    {
      "at": "2026-03-19T19:08:44+00:00",
      "actor": "legacy",
      "action": "legacy_note",
      "note": "whatsapp delivery requested recorded for +5491100000015 with allowed claim 'solicitado'"
    },
    {
      "at": "2026-03-19T19:08:44+00:00",
      "actor": "legacy",
      "action": "legacy_note",
      "note": "whatsapp delivery accepted_by_gateway recorded for +5491100000015 with allowed claim 'aceptado por gateway'"
    },
    {
      "at": "2026-03-20T23:54:07Z",
      "actor": "system",
      "action": "migrated_from_legacy",
      "note": "Migrated legacy task. legacy_ref=task-20260319T190843Z-77fc20ae; backup=tasks/legacy_backup/task-20260319T190843Z-77fc20ae.json.bak.20260320T235407Z.json"
    }
  ]
}
