{
  "id": "task-20260319T190109Z-b2b84b56",
  "title": "Verify delivery verified-by-user path",
  "objective": "Verify delivery verified-by-user path",
  "status": "todo",
  "owner": "unassigned",
  "source_channel": "operator",
  "created_at": "2026-03-19T19:01:09+00:00",
  "updated_at": "2026-03-20T23:54:05Z",
  "acceptance_criteria": [],
  "evidence": [
    {
      "type": "migration",
      "path": "tasks/legacy_backup/task-20260319T190109Z-b2b84b56.json.bak.20260320T235405Z.json",
      "note": "Migrated from legacy representation. legacy_ref=task-20260319T190109Z-b2b84b56"
    }
  ],
  "artifacts": [],
  "closure_note": "",
  "history": [
    {
      "at": "2026-03-19T19:01:09+00:00",
      "actor": "legacy",
      "action": "legacy_imported",
      "note": "Legacy task imported from raw representation. legacy_ref=task-20260319T190109Z-b2b84b56"
    },
    {
      "at": "2026-03-20T23:54:05Z",
      "actor": "system",
      "action": "migrated_from_legacy",
      "note": "Migrated legacy task. legacy_ref=task-20260319T190109Z-b2b84b56; backup=tasks/legacy_backup/task-20260319T190109Z-b2b84b56.json.bak.20260320T235405Z.json"
    }
  ]
}
