{
  "id": "task-20260319T165251Z-4dd8c72f",
  "title": "Verify missing media path",
  "objective": "Verify missing media path",
  "status": "todo",
  "owner": "unassigned",
  "source_channel": "operator",
  "created_at": "2026-03-19T16:52:51+00:00",
  "updated_at": "2026-03-20T23:41:09Z",
  "acceptance_criteria": [],
  "evidence": [
    {
      "type": "migration",
      "path": "tasks/legacy_backup/task-20260319T165251Z-4dd8c72f.json.bak.20260320T234109Z.json",
      "note": "Migrated from legacy representation. legacy_ref=task-20260319T165251Z-4dd8c72f"
    }
  ],
  "artifacts": [],
  "closure_note": "",
  "history": [
    {
      "at": "2026-03-19T16:52:51+00:00",
      "actor": "legacy",
      "action": "legacy_note",
      "note": "media ingestion blocked recorded for 20260319T165250462667Z-missing-media.md"
    },
    {
      "at": "2026-03-20T23:41:09Z",
      "actor": "system",
      "action": "migrated_from_legacy",
      "note": "Migrated legacy task. legacy_ref=task-20260319T165251Z-4dd8c72f; backup=tasks/legacy_backup/task-20260319T165251Z-4dd8c72f.json.bak.20260320T234109Z.json"
    }
  ]
}
