{
  "id": "task-20260319T171719Z-0823de78",
  "title": "Verify blocked host screenshot capture",
  "objective": "Verify blocked host screenshot capture",
  "status": "todo",
  "owner": "unassigned",
  "source_channel": "operator",
  "created_at": "2026-03-19T17:17:19+00:00",
  "updated_at": "2026-03-20T23:43:24Z",
  "acceptance_criteria": [],
  "evidence": [
    {
      "type": "migration",
      "path": "tasks/legacy_backup/task-20260319T171719Z-0823de78.json.bak.20260320T234324Z.json",
      "note": "Migrated from legacy representation. legacy_ref=task-20260319T171719Z-0823de78"
    }
  ],
  "artifacts": [],
  "closure_note": "",
  "history": [
    {
      "at": "2026-03-19T17:17:19+00:00",
      "actor": "legacy",
      "action": "legacy_note",
      "note": "host screenshot blocked recorded for target desktop-root"
    },
    {
      "at": "2026-03-20T23:43:24Z",
      "actor": "system",
      "action": "migrated_from_legacy",
      "note": "Migrated legacy task. legacy_ref=task-20260319T171719Z-0823de78; backup=tasks/legacy_backup/task-20260319T171719Z-0823de78.json.bak.20260320T234324Z.json"
    }
  ]
}
