{
  "id": "task-20260315T040023Z-7b6f6605",
  "title": "Capability verification / orchestration v3 success / local self check",
  "objective": "Validate the local Golem environment before a delegated worker run.",
  "status": "done",
  "owner": "unassigned",
  "source_channel": "operator",
  "created_at": "2026-03-15T04:00:23+00:00",
  "updated_at": "2026-03-20T20:37:06Z",
  "acceptance_criteria": [],
  "evidence": [
    {
      "type": "migration",
      "path": "tasks/legacy_backup/task-20260315T040023Z-7b6f6605.json.bak.20260320T203706Z.json",
      "note": "Migrated from legacy representation. legacy_ref=task-20260315T040023Z-7b6f6605"
    }
  ],
  "artifacts": [],
  "closure_note": "",
  "history": [
    {
      "at": "2026-03-15T04:00:23+00:00",
      "actor": "legacy",
      "action": "legacy_note",
      "note": "self-check completed and task closed"
    },
    {
      "at": "2026-03-20T20:37:06Z",
      "actor": "system",
      "action": "migrated_from_legacy",
      "note": "Migrated legacy task. legacy_ref=task-20260315T040023Z-7b6f6605; backup=tasks/legacy_backup/task-20260315T040023Z-7b6f6605.json.bak.20260320T203706Z.json"
    }
  ]
}
