{
  "id": "task-20260315T210517Z-4c27d941",
  "title": "Multi worker await blocked path / local self-check",
  "objective": "Validate the local Golem environment before a delegated worker run.",
  "status": "done",
  "owner": "unassigned",
  "source_channel": "operator",
  "created_at": "2026-03-15T21:05:17+00:00",
  "updated_at": "2026-03-20T21:04:15Z",
  "acceptance_criteria": [],
  "evidence": [
    {
      "type": "migration",
      "path": "tasks/legacy_backup/task-20260315T210517Z-4c27d941.json.bak.20260320T210415Z.json",
      "note": "Migrated from legacy representation. legacy_ref=task-20260315T210517Z-4c27d941"
    }
  ],
  "artifacts": [],
  "closure_note": "",
  "history": [
    {
      "at": "2026-03-15T21:05:17+00:00",
      "actor": "legacy",
      "action": "legacy_note",
      "note": "self-check completed and task closed"
    },
    {
      "at": "2026-03-20T21:04:15Z",
      "actor": "system",
      "action": "migrated_from_legacy",
      "note": "Migrated legacy task. legacy_ref=task-20260315T210517Z-4c27d941; backup=tasks/legacy_backup/task-20260315T210517Z-4c27d941.json.bak.20260320T210415Z.json"
    }
  ]
}
