{
  "id": "task-20260315T034004Z-be6eb5a1",
  "title": "Capability verification / task lifecycle",
  "objective": "Capability verification / task lifecycle",
  "status": "done",
  "owner": "unassigned",
  "source_channel": "operator",
  "created_at": "2026-03-15T03:40:04+00:00",
  "updated_at": "2026-03-20T20:10:38Z",
  "acceptance_criteria": [],
  "evidence": [
    {
      "type": "migration",
      "path": "tasks/legacy_backup/task-20260315T034004Z-be6eb5a1.json.bak.20260320T201038Z.json",
      "note": "Migrated from legacy representation. legacy_ref=task-20260315T034004Z-be6eb5a1"
    }
  ],
  "artifacts": [],
  "closure_note": "",
  "history": [
    {
      "at": "2026-03-15T03:40:04+00:00",
      "actor": "legacy",
      "action": "legacy_note",
      "note": "task lifecycle verification completed"
    },
    {
      "at": "2026-03-20T20:10:38Z",
      "actor": "system",
      "action": "migrated_from_legacy",
      "note": "Migrated legacy task. legacy_ref=task-20260315T034004Z-be6eb5a1; backup=tasks/legacy_backup/task-20260315T034004Z-be6eb5a1.json.bak.20260320T201038Z.json"
    }
  ]
}
